{
  "schemaVersion": "1.0",
  "package": "com.ss.android.ugc.aweme",
  "version": "39.8.0",
  "versionCode": 390801,
  "abi": [
    "arm64-v8a"
  ],
  "minSdk": 23,
  "source": {
    "type": "https",
    "url": "https://ugapk.com/mGFG",
    "note": "当前抖音官网 douyinstatic 主脚本 Android 下载面板唯一列出的 64 位短链；本次跟随到字节官方委托 CDN 后按摘要固定，短链不作为版本身份。"
  },
  "licenseNote": "仅用于本项目内部未登录兼容性测试；不得提交 APK、重新分发、点赞、评论、关注或发送内容。",
  "sizeBytes": 355818066,
  "sha256": "863707c8bac6c18a33907c4c2292d7994b4be0bc38bde1f24b7370e34cfe0a42",
  "signingCertificateSha256": "5182ae3b1b85337bb182cf24882449f84447ded18e296a747a9f6a0a2622512e"
}
